{
  "$schema": "./tenkacloud-release.schema.json",
  "schemaVersion": 2,
  "release": {
    "version": "1.10.1",
    "status": "candidate"
  },
  "sources": {
    "platform": {
      "repository": "https://github.com/susumutomita/TenkaCloud.git"
    },
    "catalog": {
      "repository": "https://github.com/susumutomita/TenkaCloudChallenge.git",
      "commit": "dd7dbac4682ffe15a189c2e47b1db03366f5e380"
    }
  },
  "artifacts": {
    "simulatorImage": "ghcr.io/susumutomita/tenkacloud-simulator@sha256:049c6c165f9947b386b2c5864983aebefba26e996ec62859dae0e9814c52d505"
  },
  "toolchain": {
    "bun": "1.3.11",
    "node": {
      "development": "24",
      "launcher": "22"
    },
    "awsCdk": {
      "cli": "2.1141.0",
      "library": "2.262.1"
    }
  },
  "compatibility": {
    "qualificationTargets": [
      {
        "mode": "lite",
        "regions": ["ap-northeast-1"]
      }
    ],
    "supportedModes": [],
    "contracts": [
      {
        "id": "problem-pack-manifest",
        "version": "1"
      }
    ]
  },
  "verification": {
    "goldenPathRuns": []
  },
  "knownLimitations": [
    "No fresh-environment Golden Path run is attached, so this release is not certified for third-party production use.",
    "No deployment mode or AWS region is certified by this manifest.",
    "The platform commit of this release is derived from its v1.10.1 tag at publish time (#3024); the manifest lives inside that tree and cannot record it.",
    "The Lite launcher uses Node.js 22 because its managed CodeBuild image does not provide Node.js 24; repository development requires Node.js 24."
  ]
}
